Cast 1,Cast 2,Cast 3,Cast 4,Cast 5,Cast 6,Description,Director 1,Director 2,Director 3,Genre,Rating,Release Date,Runtime,Studio,Title,Writer 1,Writer 2,Writer 3,Writer 4,Year
Jos Luis Gutirrez,Alvar Gordejuela,Jos Navar,Maria Molins,Adrin Salzedo,Quim Avila,"Despite being blocked at almost every turn in pursuit of the sport he loved, Seve Ballesteros fought against adversity to become the most spectacular and charismatic golfer to ever play the game. Seve combines dramatic recreations with archive footage to tell his incredible rags to riches story from humble beginnings to becoming world number one and the greatest golfer of a generation.",John-Paul Davidson,Director Not Available,Director Not Available,Documentary,NR,3/25/2016,124 minutes,Level 33 Entertainment,Seve the Movie,Tom Hodgson,Writer Not Available,Writer Not Available,Writer Not Available,2016
Manny Pacquiao,Liam Neeson,Jeremy Piven,Jimmy Kimmel,Mark Wahlberg,Oscar De La Hoya,"Synopsis: From abject poverty to becoming a ten time boxing world champion and history's first boxing congressman, international icon Manny Pacquiao is the definition of a Cinderella story. In the Philippines, he first entered the ring as a sixteen year old weighing 98 pounds with the goal of earning money to feed his family. Now, almost twenty years later, when he fights, the country of 100 million people comes to a complete standstill to watch. Today at the height of his career, he is faced with maneuvering an unscrupulous sport and political duties, while still maintaining a personal life. The question now is what bridge is too far for Manny Pacquiao to cross? (C) Gravitas",Leon Gast,Ryan Moore,Director Not Available,Documentary,PG-13,1/23/2015,109 minutes,Gravitas Ventures,Manny,Writer Not Available,Writer Not Available,Writer Not Available,Writer Not Available,2015
Ellen Burstyn,Olympia Dukakis,Diane Ladd,Danny Aiello,Lainie Kazan,Jeff Howell,"A trio of Jewish widows, calling themselves ""The Cemetery Club"" gather every week to visit the graves of their husbands and then go to the local deli to hash out the details of their lives. It's a good routine until one of the widows finds a beau.",Bill Duke,Director Not Available,Director Not Available,Documentary,PG-13,2/03/1993,114 minutes,Mtropole Films,The Cemetery Club,Jay Presson Allen,Ivan Menchell,Writer Not Available,Writer Not Available,1993
Andy Goldsworthy,Cast Not Available,Cast Not Available,Cast Not Available,Cast Not Available,Cast Not Available,"Documentarian Thomas Riedelsheimer shows us Andy Goldsworthy as he creates art in natural settings using natural materials such as driftwood, ice, mud, leaves, and stones. Goldsworthy comments on his ""earthworks"" and occasionally responds to offscreen questions from Riedelsheimer while he painstakingly builds his outdoors sculptures. With some exceptions, such as a winding stone wall that he built in Mountainville, NY, Goldsworthy's creations are intentionally mutable works. We see how several of them fall apart, melt, or drift away due to exposure to the elements; we also see, for example, a complex structure of interconnected sticks collapse while Goldsworthy is still working on it. Riedelsheimer takes us to Goldsworthy's home in Penport, Scotland, and to a French museum, but the emphasis of the film is on observing Goldsworthy at work. ~ Todd Kristel, Rovi",Thomas Riedelsheimer,Director Not Available,Director Not Available,Documentary,G,1/01/2002,90 minutes,New Video,Rivers and Tides: Andy Goldsworthy Working With Time,Thomas Riedelsheimer,Writer Not Available,Writer Not Available,Writer Not Available,2002
Buffy Sainte-Marie,Martin Scorsese,Robbie Robertson,Tony Bennett,Iggy Pop,Steven Tyler,"RUMBLE: The Indians Who Rocked the World brings to light a profound and missing chapter in the history of American music: the Indigenous influence. Featuring music icons Charley Patton, Mildred Bailey, Link Wray, Jimi Hendrix, Jesse Ed Davis, Buffy Saint-Marie, Robbie Robertson, Randy Castillo and Taboo, RUMBLE shows how these pioneering Native musicians helped shape the soundtracks of our lives.",Catherine Bainbridge,Alfonso Maiorana,Director Not Available,Documentary,NR,7/26/2017,103 minutes,Rezolution Pictures,RUMBLE: The Indians Who Rocked the World,Catherine Bainbridge,Alfonso Maiorana,Writer Not Available,Writer Not Available,2017
Vincent Lindon,Soko,Chiara Mastroianni,Olivier Rabourdin,Roxane Duran,Lisa Lamtrie,"After suffering an inexplicable seizure which leaves her paralyzed on her right side,19-year-old illiterate kitchen maid Augustine (27 year-old singer-turned-actress Soko in a break out performance), is shipped off to Paris' all female psychiatric hospital Piti-Salptriere which specializes in detecting the then-fashionable ailment of 'hysteria'. Augustine captures the attention of Dr. Charcot (Vincent Lindon, Mademoiselle Chambon, Welcome) after a seizure which appears to give her intense physical pleasure. Intrigued, he begins using her as his principal subject hypnotizing her in front of fellow doctors - as she displays her spectacular fits in lecture halls - and eventually blurring the lines between doctor and patient. (c) Music Box Films",Alice Winocour,Director Not Available,Director Not Available,Documentary,NR,5/17/2013,55 minutes,Music Box Films,Augustine,Alice Winocour,Writer Not Available,Writer Not Available,Writer Not Available,2013
Pete  Seeger,Bruce Springsteen,Natalie Maines,Tom Paxton,David Dunaway,Bess Lomax Hawes,A social history through the life of one of this country's most significant folk artists of our time: Pete Seeger.,Jim Brown,Director Not Available,Director Not Available,Documentary,PG,4/29/2007,91 minutes,The Weinstein Company,Pete Seeger: The Power of Song,Writer Not Available,Writer Not Available,Writer Not Available,Writer Not Available,2007
Donald Sutherland,Rodolfo Coria,Cast Not Available,Cast Not Available,Cast Not Available,Cast Not Available,"Since the discovery of the very first fossil, dinosaurs have captured the imagination of historians both young and old. They are the planet's greatest mystery. How is it that these enormous, majestic beasts could have simply disappeared from the surface of the planet? In this release, amateur paleontologists are invited to take a 3-D voyage into the prehistoric world as the foremost scientists and researchers on the era explore the greatest paleontological discoveries made by man in addition to offering groundbreaking computer-generated footage of such dinosaurs as the Giganotosaurus and Argentinosaurus. ~ Jason Buchanan, Rovi",Marc Fafard,Director Not Available,Director Not Available,Documentary,NR,5/09/2007,47 minutes,Sky High Entertainment,Dinosaurs: Giants of Patagonia,Writer Not Available,Writer Not Available,Writer Not Available,Writer Not Available,2007
Hayao Miyazaki,Hideaki Anno,Isao Takahata,John Lasseter,Toshio Suzuki,Cast Not Available,About Hayao Miyazaki's life and Studio Ghibli.,Mami Sunada,Director Not Available,Director Not Available,Documentary,NR,11/28/2014,118 minutes,GKIDS,The Kingdom of Dreams and Madness,Mami Sunada,Writer Not Available,Writer Not Available,Writer Not Available,2014
Dustin Hoffman,Martin Abramowitz,Maury Allen,Rebecca Alpert,Yogi Berra,Ron Von Blomberg,"JEWS AND BASEBALL: AN AMERICAN LOVE STORY explores the connection between Jewish Americans and baseball, our nation's most iconic institution. More than a film about sports, it is a story of immigration, assimilation, bigotry, heroism, the passing on of traditions, and the shattering of stereotypes ""You should be an attorney or a doctor, but not a ballplayer,"" one former major leaguer remembers, describing the prejudices that he and other Jewish athletes faced. But despite the stereotypes, and in the face of hostility from fans and even violence from opposing players, there have been standout Jewish players in every decade from the 1860s to the present. JEWS AND BASEBALL is the first major documentary to tell their stories. Interviews include fans, writers, executives, and especially players - including Al Rosen, Kevin Youkilis, Shawn Green, Norm Sherry, Ron Blomberg, Bob Feller, Yogi Berra, and a rare interview with the legendary Hall of Fame pitcher Sandy Koufax. Fans Ron Howard and Larry King speak of the meaning of Jewish ballplayers in their own lives, while historians and even two baseball-loving rabbis relate the stories of Jewish players to the turbulent history of the last century. These powerful personal and historical stories are interwoven with an extraordinary collection of rare archival footage and photos, and a musical score ranging from Benny Goodman to Yo-Yo Ma to Rush. Dustin Hoffman narrates this engaging story of great drama, unforgettable games, and the broad sweep of American history. --© Official Site",Peter Miller,Director Not Available,Director Not Available,Documentary,NR,11/17/2010,91 minutes,7th art,Jews And Baseball: An American Love Story,Ira Berkow,Writer Not Available,Writer Not Available,Writer Not Available,2010
Cast Not Available,Cast Not Available,Cast Not Available,Cast Not Available,Cast Not Available,Cast Not Available,"Energy is the foundation of modern life. Our transportation, global commerce, food and water, housing, medicine, communications and computing all depend on it. Yet energy is in a sweeping period of transition. Renewables are entering the landscape. Unconventional gas and oil are changing our ideas of supply. Opinions on nuclear are shifting. Carbon concerns may, or may not, affect global production and consumption. What does the future of energy really hold? Join energy visionary Dr. Scott Tinker on a spectacular global adventure to find out. Dr. Tinker explores the world's leading energy sites, from coal to solar, oil to biofuels, many highly restricted and never before seen on film. He gets straight answers from the people driving energy today, international leaders of government, industry and academia. In the end, he cuts through the confusion to discover a path to our future that is surprising and remarkably pragmatic. -- (C) Official Site",Thomas Hefferon,Director Not Available,Director Not Available,Documentary,NR,9/20/2012,120 minutes,Arcos Pictures,Switch,Writer Not Available,Writer Not Available,Writer Not Available,Writer Not Available,2012
Richard M. Sherman,Robert B. Sherman,Cast Not Available,Cast Not Available,Cast Not Available,Cast Not Available,"""The Boys"" documents the extraordinary lives of two radically diverse siblings: the multi-award-winning songwriting team-- the Sherman Brothers (Robert B. Sherman and Richard M. Sherman). The documentary traces the origins of their remarkable careers--from their childhood and young adulthood, through a six-decade collaboration that included 50 motion pictures and a catalogue of more than a thousand songs for television, records, theme parks and stage.",Jeffrey C. Sherman,Gregory V. Sherman,Director Not Available,Documentary,PG,5/22/2009,101 minutes,Walt Disney Pictures,The Boys: The Sherman Brothers' Story,Writer Not Available,Writer Not Available,Writer Not Available,Writer Not Available,2009
Werner Herzog,Cast Not Available,Cast Not Available,Cast Not Available,Cast Not Available,Cast Not Available,"Straddling a line between documentary and science fiction, Werner Herzog's Lektionen in Finsternis is an epic visual poem set in the burning oil fields of Kuwait following the 1990-1991 Persian Gulf War. Herzog, as much a daredevil as a documentarian, took his small crew in a helicopter and, floating above the fields, photographed jaw-dropping footage of the blazing, blackened landscape. Alternately horrific and majestic, the movie is a phantasmagoric, if distanced, catalog of horrors. Boiling lakes of crude oil, twisted scraps of melted metal, and ominous billows of smoke and fire abound. On the ground, the images are just as otherworldly. Herzog filmed scenes of firemen in full-body suits, working -- futilely it seems -- to contain the blaze. There are also a couple of interviews with Kuwaiti women, who talk heartbreakingly of the brutalities they suffered at the hands of Iraqi soldiers. In his voice-over narration, Herzog assumes the identity of a spectator from another planet, making bemused comments about the catastrophe with no attempt to inform the viewer of the factual circumstances behind it. His high-flown rhetoric, dense with mythical portent and allusiveness, underscores this visionary movie's detached view of the destruction of the Kuwaiti oil fields.",Werner Herzog,Director Not Available,Director Not Available,Documentary,NR,10/25/1995,50 minutes,Canal+,Lessons of Darkness,Werner Herzog,Writer Not Available,Writer Not Available,Writer Not Available,1995
Ghada Amer,Kiki Smith,Marina Abramovic,Swoon,Nancy Spero,Cast Not Available,"Filmmaker Chiara Clemente profiles five diverse female artists, each of whom calls New York City home, in this intimate documentary. In the late '50s and '60s, Nancy Spero was on the front lines of the feminist movement. Today she creates art that challenges the polemics of warfare and sexual identity. Pioneering performance artist Marina Abramovic, meanwhile, responds to contemporary cultural issued by using her body as a canvas. Glass, plaster, ceramic, bronze, and paper provide Kiki Smith with the appropriate tools to address philosophical, social, and spiritual aspects of the human body, and Ghada Amer rails against ""institutionalized feminism"" by painting erotic canvases with traditional needle and thread. Lastly, emerging New York artist Swoon creates vibrant street art that amplifies the pulse of urban life. Over the course of the two years in which Our City Dreams was shot, each artist faces triumphs and challenges that give the viewer a tantalizing glimpse into the creative process. ~ Jason Buchanan, Rovi",Chiara Clemente,Director Not Available,Director Not Available,Documentary,NR,8/10/2008,87 minutes,First Run Features (,Our City Dreams,Writer Not Available,Writer Not Available,Writer Not Available,Writer Not Available,2008
Laurent Lucas,Aurlien Recoing,Audrey Dana,Pascal Greggory,Henri Guybet,Grgoire Leprince-Ringuet,"The Jewish Cardinal tells the amazing true story of Jean-Marie Lustiger, the son of Polish-Jewish immigrants, who maintained his cultural identity as a Jew even after converting to Catholicism at a young age, and later joining the priesthood. Quickly rising within the ranks of the Church, Lustiger was appointed Archbishop of Paris by Pope Jean Paul II - and found a new platform to celebrate his dual identity as a Catholic Jew, earning him both friends and enemies from either group. When Carmelite nuns settle down to build a convent within the cursed walls of Auschwitz, Lustiger finds himself a mediator between the two communities - and may be forced at last to choose his side. (c) Film Movement",Ilan Duran Cohen,Director Not Available,Director Not Available,Documentary,NR,4/11/2014,96 minutes,Film Movement,The Jewish Cardinal,Chantal Derudder,Ilan Duran Cohen,Writer Not Available,Writer Not Available,2014
Mark Pragnell,Heather Barnett,Bryn Dentinger,Tim Boon,Andrew Adamatsky,Peter Zauner-Klaus,"The Creeping Garden is a feature length creative documentary exploring the work of fringe scientists, mycologists and artists, and their relationship with the extraordinary plasmodial slime mould. The slime mould is being used to explore biological-inspired design, emergence theory, unconventional computing and robot controllers, much of which borders on the world of science fiction. But as well as exploring the slime mould in the lab, the film also travels out into the wild, hunting for the organisms in their natural habitat.",Jasper Sharp,Tim Grabham,Director Not Available,Documentary,NR,9/30/2015,81 minutes,Cinema Iloobia,The Creeping Garden,Writer Not Available,Writer Not Available,Writer Not Available,Writer Not Available,2015
Q-Tip,A Tribe Called Quest,Phife Dawg,Ali Shaheed Muhammad,Jarobi White,Adam Yauch,"A documentary film directed by Michael Rapaport about one of the most influential and groundbreaking musical groups in hip-hop history. Having released five gold and platinum selling albums within eight years, A Tribe Called Quest has been one of the most commercially successful and artistically significant musical groups in recent history, and regarded as iconic pioneers of hip hop. The band's sudden break-up in 1998 shocked the industry and saddened the scores of fans, whose appetite for the group's innovative musical stylings never seems to diminish. A hard-core fan himself, Rapaport sets out on tour with A Tribe Called Quest in 2008, when they reunited to perform sold-out concerts across the country, almost ten years after the release of their last album, The Love Movement. -- (C) Sony Classics",Michael Rapaport,Director Not Available,Director Not Available,Documentary,R,7/08/2011,98 minutes,Sony Pictures Classics,Beats Rhymes & Life: The Travels of a Tribe Called Quest,Writer Not Available,Writer Not Available,Writer Not Available,Writer Not Available,2011
Roman Polanski,Jackie Stewart,Helen Stewart,Cast Not Available,Cast Not Available,Cast Not Available,"In 1971, Motor Racing fan Roman Polanski spent a weekend with world champion driver Jackie Stewart as he attempted to win the Monaco Grand Prix. Polanski was given intimate access to Stewart's world for three days, both on the track and off. The result is an extraordinarily rare glimpse into the life of a gifted athlete at the height of his powers. Forty years on, Polanski and Stewart meet once again. In a remarkable post-script, they discuss the sport, both past and present, with a unique and unmatched perspective.(c) Submarine",Roman Polanski,Director Not Available,Director Not Available,Documentary,NR,11/22/2013,94 minutes,Submarine Media,Weekend Of A Champion,Frank Simon,Writer Not Available,Writer Not Available,Writer Not Available,2013
Jafar Panahi,Mojtaba Mirtahmasb,Cast Not Available,Cast Not Available,Cast Not Available,Cast Not Available,"This clandestine documentary, shot partially on an iPhone and smuggled into France in a cake for a last-minute submission to Cannes, depicts the day-to-day life of acclaimed director Jafar Panahi (Offside, The Circle) during his house arrest in his Tehran apartment. While appealing his sentence - six years in prison and a 20 year ban from filmmaking - Panahi is seen talking to his family and lawyer on the phone, discussing his plight with Mirtahmasb and reflecting on the meaning of the art of filmmaking. -- (C) Palisades Tartan",Jafar Panahi,Mojtaba Mirtahmasb,Director Not Available,Documentary,NR,2/29/2012,75 minutes,Palisades Tartan,This Is Not a Film,Mojtaba Mirtahmasb,Jafar Panahi,Writer Not Available,Writer Not Available,2012
Gunther Hauk,Michael Pollan,Dr. Vandana Shiva,Raj Patel,Carlo Petrini,Horst Kornberger,"QUEEN OF THE SUN: What Are the Bees Telling Us? is a profound, alternative look at the global bee crisis from Taggart Siegel, director of THE REAL DIRT ON FARMER JOHN. Taking us on a journey through the catastrophic disappearance of bees and the mysterious world of the beehive, this engaging and ultimately uplifting film weaves an unusual and dramatic story of the heartfelt struggles of beekeepers, scientists and philosophers from around the world including Michael Pollan, Gunther Hauk and Vandana Shiva. Together they reveal both the problems and the solutions in renewing a culture in balance with nature. -- (C) Official Site",Taggart Siegel,Director Not Available,Director Not Available,Documentary,NR,3/25/2011,83 minutes,Independent Pictures,Queen Of The Sun: What are the Bees Telling Us?,Writer Not Available,Writer Not Available,Writer Not Available,Writer Not Available,2011
Hans-Joachim Klein,Mark Pierpont,Joe Loya,Mark Salzman,Cast Not Available,Cast Not Available,"Academy Award-winning filmmaker Jessica Yu offers an unusual look at the simultaneous diversity and commonality of four very different men in this documentary. In Protagonist, Yu recalls the structural format of the ancient Greek playwright Euripides -- whose stories were often marked by human tragedy, the commentary of a chorus of independent observers, and the sudden and unexpected intervention of the divine -- as she chronicles the lives of a thief, a student of martial arts, a preacher who has renounced his past as a homosexual, and a political terrorist. Protagonist was screened in competition as part of the 2007 Sundance Film Festival.",Jessica Yu,Director Not Available,Director Not Available,Documentary,R,11/30/2007,90 minutes,IFC Films,Protagonist,Jessica Yu,Writer Not Available,Writer Not Available,Writer Not Available,2007
Frank Amonte,Michael Matz,Daniel Hendricks,Kiaran McLaughlin,Bob Holthus,Chuck Chambers,"Filmmaking duo John and Brad Hennegan travel from Arkansas to the United Arab Emirates as they follow six trainers in preparation for the most prestigious horse race on the planet in this documentary detailing the euphoria and heartbreak of the Kentucky Derby. As preparations for the 2006 Kentucky Derby get underway, six trainers and their horses -- including the legendary Barbaro -- defy all odds by qualifying for the event that has been dubbed ""the most exciting two minutes in sports."" Now, for the first time ever, viewers can go behind the scenes to find out exactly what these dedicated horsemen go through as they prepare to compete in the ultimate equestrian event.",The Hennegan Brothers,Director Not Available,Director Not Available,Documentary,PG-13,4/18/2008,100 minutes,Truly Indie,The First Saturday in May,The Hennegan Brothers,Mark Krewatch,Writer Not Available,Writer Not Available,2008
"Steven ""AkA Moe""",Cast Not Available,Cast Not Available,Cast Not Available,Cast Not Available,Cast Not Available,"To Baltimore locals, the 12 O'Clock Boys are hooligans - a group of urban dirt-bikers that perform death-defying stunts at excessive speeds through traffic and impressively evade the hamstrung police, who must adhere to a no-chase policy to maintain public safety. Yet they are heroes to Pug, a bright, young adolescent living in the city's dangerous Westside neighborhood with his charismatic mother Coco, extended family, and a menagerie of animals to which he tends in his long-standing hope to be a veterinarian. Yet as his obsession with the 12 O'Clock Boys grows, his desire to join the bikers begins eclipsing everything else in his life, much to Coco's dismay. Filled with stunningly kinetic footage that puts the viewer on up-close ride-alongs with the bikers, 12 O'CLOCK BOYS provides a compelling and personal story of a young boy and his dangerous, thrilling dream. (c) Oscilloscope",Lotfy Nathan,Director Not Available,Director Not Available,Documentary,NR,1/31/2014,76 minutes,Oscilloscope Laboratories,12 O'clock Boys,Lotfy Nathan,Writer Not Available,Writer Not Available,Writer Not Available,2014
Werner Herzog,David Ainley,Samuel S. Bowser,Regina Eisert,Kevin Emery,Ashrita Furman,"Werner Herzog confirms his standing as poet laureate of men in extreme situations with ""Encounters at the End of the World."" In this visually stunning exploration, Herzog travels to the Antarctic community of McMurdo Station, headquarters of the National Science Foundation and home to 1,100 people during the austral summer (Oct-Feb). Over the course of his journey, Herzog examines human nature and Mother nature, juxtaposing breathtaking locations with the profound, surreal, and sometimes absurd experiences of the marine biologists, physicists, plumbers, and truck drivers who choose to form a society as far away from society as one can get.",Werner Herzog,Director Not Available,Director Not Available,Documentary,G,9/01/2007,99 minutes,ThinkFilm,Encounters at the End of the World,Werner Herzog,Writer Not Available,Writer Not Available,Writer Not Available,2007
Roger Ebert,Chaz Ebert,Raven Evans,Ava DuVernay,Ramin Bahrani,Richard Corliss,"Acclaimed director Steve James (Hoop Dreams) and executive producers Martin Scorsese (The Departed) and Steven Zaillian (Moneyball) present LIFE ITSELF, a documentary film that recounts the inspiring and entertaining life of world-renowned film critic and social commentator Roger Ebert - a story that is by turns personal, funny, painful, and transcendent. Based on his bestselling memoir of the same name, LIFE ITSELF, explores the legacy of Roger Ebert's life, from his Pulitzer Prize-winning film criticism at the Chicago Sun-Times to becoming one of the most influential cultural voices in America. (C) Magnolia",Steve James (II),Director Not Available,Director Not Available,Documentary,R,7/04/2014,120 minutes,Magnolia Pictures,Life Itself,Writer Not Available,Writer Not Available,Writer Not Available,Writer Not Available,2014
