Cast 1,Cast 2,Cast 3,Cast 4,Cast 5,Cast 6,Description,Director 1,Director 2,Director 3,Genre,Rating,Release Date,Runtime,Studio,Title,Writer 1,Writer 2,Writer 3,Writer 4,Year
Bob Hoskins,Cathy Tyson,Michael Caine,Clarke Peters,Kate Hardie,Robbie Coltrane,"Bob Hoskins plays George, a tough but basically goodhearted British mob flunky, recently released from prison, where he'd served a term to cover up for his gangster boss (Michael Caine). Still willing to be everyone's doormat, George agrees to act as chauffeur for Simone (Cathy Tyson), a haughty, high-priced call girl. They don't like each other at first, but George begins to fall for her and take a protective interest. She implores him to help her find her only truly friend, a prostitute named Cathy (Kate Hardie). Touched by this devotion, George locates the girl, only to be chagrined to learn that Simone and Cathy are lovers. Hoskins is used and abused by so many people in Mona Lisa that when the worm finally does turn, you feel like cheering--even though it doesn't make him any happier. Director Neil Jordan cowrote this study of underworld mores with David Leland.",Neil Jordan,Director Not Available,Director Not Available,Romance,R,6/13/1986,104 minutes,Anchor Bay Entertainment,Mona Lisa,David Leland,Neil Jordan,Writer Not Available,Writer Not Available,1986
James Garner,Sally Field,Corey Haim,Brian Kerwin,Dennis Burkley,Georgann Johnson,"Newly divorced Emma Moriarty (Sally Field) moves herself and her young son to a small Arizona town, hoping to establish a horse farm. Town pharmacist Murphy Jones (James Garner), the town's most eligible bachelor, develops a platonic friendship with Emma, but he decides to keep his distance when her ex-husband Bobby Jack (Brian Kerwin), who claims he's changed his irresponsible ways, moves back in with her. At a party at Emma's ranch, Murphy and Bobby Jack get into a verbal row, but nothing is settled until Wanda (Anna Levine) shows up with two babies in tow, claiming that Bobby Jack is the father. Once rid of her ex, Emma commisserates with her friend Murphy at his drug store--and is quite surprised to discover that she's fallen in love with the older man, and he with her. Murphy's Romance is a very gentle romantic comedy; even Murphy's cast-away lady friend (Georgann Johnson) behaves like a civilized human being instead of a woman scorned.",Martin Ritt,Director Not Available,Director Not Available,Romance,PG-13 ,12/25/1985,108 minutes,Sony Pictures Home Entertainment,Murphy's Romance,Harriet Frank Jr. / Irving Ravetch,Irving Ravetch,Writer Not Available,Writer Not Available,1985
Jude Law,Gretchen Mol,Jennifer Tilly,Gretchen Moll,Martha Plimpton,Brenda Blethyn,"In this film, Danny, an artist educated in England after the death of his father, is back in the States to help restore a church, and he meets childhood friend Anna Swan, now all grown up and very beautiful. However, she's also become cynical and has a fiance to boot.",Charlie Peters,Director Not Available,Director Not Available,Romance,PG-13 ,12/31/1997,105 minutes,MGM Home Entertainment,Music From Another Room,Charlie Peters,Writer Not Available,Writer Not Available,Writer Not Available,1997
Joseph Fiennes,David Wenham,Adrian Lester,Anne Brochet,Rosemary Murphy,Nikolina Kujaca,"Following up on his acclaimed debut After the Rain, Milcho Manchevski spins this ambitious, and unusual, Balkan western. The film opens in New York with an old woman, living in a crammed apartment full of old photos, who outwits a burglar and forces him to listen to her stories. She recounts the saga of Luke and Elijah, a couple freewheeling cowboys during the heyday of the American West. A fight over a whore named Lily ends their friendship; Elijah marries her while Luke turns into an embittered bandit, travelling the world. He eventually settles in with some cattle rustlers in Macedonia. Improbably, Luke and Elijah cross paths again, and soon after a complicated series of flukes and misadventures, end up embroiled in the Turks brutal attempts at maintaining control of the peninsula. This film was screened at the 2001 Toronto Film Festival.",Milcho Manchevski,Director Not Available,Director Not Available,Romance,R ,1/01/2003,127 minutes,Lions Gate Films,Dust,Milcho Manchevski,Writer Not Available,Writer Not Available,Writer Not Available,2003
Martin Landau,Ellen Burstyn,Elizabeth Banks,Adam Scott,Scott Beehner,Michael Riley Mogis,"Martin Landau and Ellen Burstyn topline the debut of writer/director Nik Fackler in Lovely Still, a whimsical romance tale that follows an elderly grocery-store bagger (Landau) who experiences his first pangs of love in the form of Burstyn. Elizabeth Banks portrays the woman's daughter, while Adam Scott handles the role of the store's owner.",Nik Fackler,Director Not Available,Director Not Available,Romance,PG ,9/10/2010,92 minutes,Monterey Media,"Lovely, Still",Nik Fackler,Writer Not Available,Writer Not Available,Writer Not Available,2010
Catherine Deneuve,Vincent Perez (III),Linh-Dan Pham,Jean Yanne,Dominique Blanc,Henri Marteau,"Set in French Indochina during the politically turbulent 1930s, Regis Wargnier's film stars Catherine Deneuve as a plantation owner who becomes involved in a torrid love triangle between a handsome French soldier (Vincent Prez) and her beloved adopted Asian daughter (Linh Dam Phan). Won an Oscar for Best Foreign Film.",Rgis Wargnier,Director Not Available,Director Not Available,Romance,PG-13,6/01/1992,156 minutes,Sony Pictures Home Entertainment,Indochine,Rgis Wargnier,Louis Gardel,Catherine Cohen,Erik Orsenna,1992
Charlotte Gainsbourg,Gael Garca Bernal,Alain Chabat,Miou-Miou,Pierre Vaneck,Emma de Caunes,"Inventive Eternal Sunshine of the Spotless Mind director Michel Gondry takes a surreal trip through the mind of an introverted but wildly creative man whose attempts to balance his colorful dreams with his stark reality are complicated by the arrival of a beautiful woman into his life. Shy St (C)phane (Gael Garca Bernal) has returned to his childhood hometown to accept a new job. When the prospective employment offer fails to live up to expectations, however, St (C)phane is at least comforted by the close bond he has formed with his creative-thinking neighbor St (C)phanie (Charlotte Gainsbourg). Their blossoming romance finally awakens the sleeping confidence that the withdrawn St (C)phane was previously capable of displaying only in his dreams, but St (C)phane and St (C)phanie find their relationship challenged when lingering insecurities prompt the smitten visionary to confront an old dilemma that can't be solved by the Science of Sleep. ~ Jason Buchanan, Rovi",Michel Gondry,Director Not Available,Director Not Available,Romance,R ,6/18/2006,106 minutes,Warner Independent Pictures,The Science of Sleep,Michel Gondry,Writer Not Available,Writer Not Available,Writer Not Available,2006
Claudette Colbert,Louise Beavers,Fredi Washington,Warren William,Ned Sparks,Juanita Quigley,"The first of two film version of Fannie Hurst's novel, 1934's Imitation of Life chronicles the friendship between two women--one white (Claudette Colbert), one black (Louise Beavers). Colbert is a widow with a baby daughter who hires Beavers, who also has a daughter, as a housekeeper. Colbert is a working girl who yearns to operate her own business, which she does thanks to Beavers' special pancake recipe. A family friend (Ned Sparks) suggests that the ladies form a corporation to merchandise the ""Aunt Delilah"" pancake mix, and within ten years both women are quite wealthy. Colbert's relationship with her teenaged daughter (Rochelle Hudson) is strained when both ladies vie for the attentions of the same man, but these problems are minor compared to the travails of Beavers, who not only must deal with the De Facto segregation of the 1930s but must also contend with her restless daughter (Fredi Washington), who resents being an African-American and attempts to pass for white. The heartbroken Beavers dies, and at her funeral her now-chastened daughter weeps out her apologies for turning her back on her mother. Imitation of Life was remade in 1959, its story glamorized and updated to accommodate star Lana Turner.",John M. Stahl,Director Not Available,Director Not Available,Romance,NR,11/26/1934,111 minutes,Universal Studios,Imitation of Life,William Hurlbut,Writer Not Available,Writer Not Available,Writer Not Available,1934
Jack Plotnick,Clinton Leupp,Jeffery Roberson,Ron Matthews,Ron Mathews,Eric Stonestreet,"The confessional, behind-the-scenes showbiz melodrama goes under the knife -- so to speak -- in this drag comedy. Girls Will Be Girls casts three male performers in the roles of Evie Harris (Jack Plotnick), a has-been starlet of the '70s who has since gone to seed in her decaying Hollywood home; her best friend and domestic servant, Coco (Clinton Leupp); and Varla (Jeffrey Roberson), the daughter of a deceased peer/rival of Evie's who shows up to rent out a room in her home. The tension among the trio of women escalates as Evie prepares for a pull-out-all-the-stops television special commemorating her past career glories, which include sundry disaster movies and TV variety shows. What Evie doesn't know is that the nave-seeming Varla has a debt to settle for her deceased mom, and will stop at nothing to seek vengeance. All three lead actors developed their characters in stage shows and cabaret acts; writer/director Richard Day wrote for such television shows as Ellen and The Larry Sanders Show before helming this film, his debut. After its 2003 Sundance premiere, Girls Will Be Girls was acquired by IFC Films for a theatrical release.",Richard Day,Director Not Available,Director Not Available,Romance,R ,1/17/2003,82 minutes,IFC Films,Girls Will Be Girls,Richard Day,Richard Day,Writer Not Available,Writer Not Available,2003
Anouk Aime,Jean-Louis Trintignant,Pierre Barouh,Valrie Lagrange,Simone Paris,Antoine Sire,"The ultimate ""date"" movie of the mid-1960s, director Claude Lelouch's A Man and a Woman (Un Homme et Une Femme) stars Jean-Louis Trintignant and Anouk Aimee in the title roles. The twosome meet at the boarding school where their children are enrolled. Aimee, an actress, misses her train home, and Trintignant, a professional race car driver, offers her a ride. It is the first of several friendly encounters which eventually blossom into love. Both want to commit to each other, but neither can shake the Past. The now-famous climactic scene in a train station was not scripted at the time of shooting, thus Aimee was unaware that director Lelouch had decided upon a tearful reunion between her and Trintignant. This explains the look of utter surprise on the actress' face. Much has been written about the possible motivation behind Lelouch's decision to film some scenes in color, others in black-and-white. None of the more ardent auterists truly want to hear the director's explanation: he'd run short of money halfway through production, and black-and-white film stock was infinitely cheaper. The winner of two Oscars (one for Best Foreign Film), A Man and A Woman also scored on the ""top ten"" with its memorable theme music by Francis Lai. A sequel, A Man and a Woman: 20 Years Later appeared....twenty years later. ~ Hal Erickson, Rovi",Claude Lalouche,Claude Lelouch,Director Not Available,Romance,NR,1/01/1966,102 minutes,Warner Home Video,A Man and a Woman,Pierre Uytterhoeven,Claude Lelouch,Writer Not Available,Writer Not Available,1966
Rebecca De Mornay,Vincent Spano,Frank Langella,Donovan Leitch,Judith Chapman,Jaime McEnnan,"French director Roger Vadim pillages his own grave in this nominal re-make of his 1956 creamy sensation And God Created Woman -- the film that made Brigitte Bardot an international star. Unfortunately, he is unable to do the same thing for the cool and cryptic Rebecca DeMornay in this version. DeMornay plays an escaped convict who lands in the limousine of New Mexico gubernatorial candidate Frank Langella and seduces him. For some inexplicable reason, she turns into a hot singing act. DeMornay also seduces innocent stud carpenter Vincent Spano along the way and suckers the poor guy into marrying her so that she can get an early parole. But the joke is on him when she announces that their marriage does not include sexual relations.",Roger Vadim,Director Not Available,Director Not Available,Romance,R ,1/01/1988,100 minutes,Vestron Video,And God Created Woman,R.J. Stewart,Writer Not Available,Writer Not Available,Writer Not Available,1988
Leslie Caron,Mel Ferrer,Zsa Zsa Gabor,Jean-Pierre Aumont,Kurt Kasznar,Amanda Blake,"Based on the story by Paul Gallico, Lili stars Leslie Caron as the title character, a 16-year-old waif who runs off to join a carnival. Embittered, crippled puppeteer Mel Ferrer treats Lili with contempt; only by speaking through his puppets is Ferrer able to express his genuine love for the girl. Before this happens, however, Caron must overcome her crush on magician Jean-Pierre Aumont, who is married to the contentious Zsa Zsa Gabor. Though not a musical (as was Carnival, the 1961 Broadway version of Lili), the film affords Leslie Caron the opportunity for a dream ballet, and also accommodates the lilting Bronislaw Kaper/Adolph Deutsch hit song ""Hi Lili, Hi Lo"". Legend has it that professional curmudgeon H.L. Mencken, who considered movies a waste of time and never bothered to see them, was persuaded to attend a showing of Lili--and loved every minute of it!",Charles Walters,Director Not Available,Director Not Available,Romance,G,3/10/1953,81 minutes,MGM Home Entertainment,Lili,Helen Deutsch,Paul Gallico,Writer Not Available,Writer Not Available,1953
Vincent Perez (III),Rachel Weisz,Ian McKellen,Joss Ackland,Kathy Bates,Tom Bell,"Loosely based on a short story by Joseph Conrad, this well-wrought tale of passion and tragedy centers on the culturally forbidden love between a 19th-century indentured servant and the mysterious shipwrecked Russian immigrant who washes upon the shores of her home in Cornwall, England.",Beeban Kidron,Director Not Available,Director Not Available,Romance,PG-13 ,1/23/1998,114 minutes,Sony Pictures Home Entertainment,Swept from the Sea,Tim Willocks,Writer Not Available,Writer Not Available,Writer Not Available,1998
Alan Alda,Ann-Margret,Mary Kay Place,John Shea,Hal Linden,Veronica Hamel,"After 20 years of marriage, Steve Giardino (Alan Alda) and his wife Jackie (Ann-Margret) agree to a divorce in this situation comedy. The focus is on both of them as they suffer through matchmaking, blind dates, and their new life as eligible singles. Donna (Mary Kay Place) is Jackie's friend, while Mel Arons (Hal Linden) is the confidante of the vain but likeable Steve. Steven worries that he will never find anyone decent to date until he meets the pretty Dr. Kay Hutton (Veronica Hamel). Jackie is enamored with a sculptor (John Shea) before his glaring faults become too much for her. While Jackie's new relationship is on the outs, Steve prepares for a new life with Kay.",Alan Alda,Director Not Available,Director Not Available,Romance,PG-13,3/25/1988,104 minutes,Paramount Pictures,A New Life,Alan Alda,Writer Not Available,Writer Not Available,Writer Not Available,1988
Ronald Reagan,Ann Sheridan,Robert Cummings,Charles Coburn,Betty Field,Claude Rains,"In this dark drama, set shortly before WWII, two young men grow up to discover that their idyllic and wholesome Midwestern hometown has a seamy side rife with jealousy, pettiness, and horrific acts.",Sam Wood,Director Not Available,Director Not Available,Romance,NR,1/01/1942,126 minutes,Warner Home Video,Kings Row,Casey Robinson,Writer Not Available,Writer Not Available,Writer Not Available,1942
Kevin Costner,Alan Rickman,Morgan Freeman,Mary Elizabeth Mastrantonio,Christian Slater,Geraldine McEwan,"This film is a '90s version of the classic Robin Hood story, with Kevin Costner starring as the good-guy thief. Costner is joined in his efforts against the murdering Sheriff of Nottingham (Alan Rickman) by Morgan Freeman who plays a philosophizing Moor, and by Nick Brimble, who plays Little John (anything but little). After Robin barely survives a watery skirmish with Little John, the two become allies and Robin joins forces with Little John's band of robber thieves to overcome the evils of the dastardly Nottingham sheriff. ~ Rovi",Kevin Reynolds,Director Not Available,Director Not Available,Romance,PG-13 ,6/14/1991,155 minutes,Warner Bros. Pictures,Robin Hood: Prince of Thieves,Pen Densham,John Watson,Writer Not Available,Writer Not Available,1991
Richard Harris,Vanessa Redgrave,Franco Nero,David Hemmings,Lionel Jeffries,Pierre Olaf,"This medieval tale recounts the story of King Arthur who seeks to establish a peaceful state by gathering together a force of knights. Sir Lancelot is the one with whom Arthur builds a strong friendship, but whose romantic inclinations towards his king's wife are reciprocated and undeniable. Before long, there is scandal and tragedy results. This feature, based on the classic from T.H. White, won Academy Awards for Best Costume Design, Best Art Direction and Best Musical Score, as well as garnishing nominations for Best Sound and Best Cinematography.",Joshua Logan,Moss Hart,Director Not Available,Romance,G,10/25/1967,179 minutes,Warner Home Video,Camelot,Alan Jay Lerner,Writer Not Available,Writer Not Available,Writer Not Available,1967
Sally Field,Paul Newman,Bob Balaban,Luther Adler,Melinda Dillon,Barry Primus,"In this legal drama from director Sydney Pollack, Sally Field stars as Megan, an ambitious newpaper reporter who, based on information from FBI investigator Rosen, played by Bob Balaban, writes a scathing article that implicates Gallagher, a reclusive business-owner played by Paul Newman, in the recent disappearance of a labor leader. When Gallagher confronts Megan and sets her straight, the two team together to prove his innocence and have a few romantic interludes along the way. Wilford Brimley and Melinda Dillon also star. ~ Matthew Tobey, Rovi",Sydney Pollack,Director Not Available,Director Not Available,Romance,PG ,11/19/1981,116 minutes,Sony Pictures Home Entertainment,Absence Of Malice,Kurt Luedtke,Writer Not Available,Writer Not Available,Writer Not Available,1981
George Clooney,Cate Blanchett,Tobey Maguire,Beau Bridges,Tony Curran,Jack Thompson,"""The Good German"" takes place in the ruins of post-WWII Berlin, where U.S. Army war correspondent Jake Geismar becomes embroiled with Lena Brandt, a former lover who is trying to escape her past in the aftermath of the war. Intrigue mounts as Jake tries to uncover the secrets Lena may be hiding in her desperation to get out of Berlin. Tully, a soldier in the American army motor pool assigned to drive Jake around the city, has black market connections that may be Lena's way out--or lead them all into even darker territory.",Steven Soderbergh,Director Not Available,Director Not Available,Romance,R ,1/19/2007,108 minutes,Warner Bros. Pictures,The Good German,Joseph Kanon,Paul Attanasio,Writer Not Available,Writer Not Available,2007
Mark Duplass,Patrick Brice,Cast Not Available,Cast Not Available,Cast Not Available,Cast Not Available,"Looking for work, Aaron (Patrick Brice) comes across a cryptic online ad: ""$1,000 for the day. Filming service. Discretion is appreciated."" Low on cash and full of naivet, he decides to go for it. He drives to a cabin in a remote mountain town where he meets Josef (Mark Duplass), his cinematic subject for the day. Josef is sincere and the project seems heartfelt, so Aaron begins to film. But as the day goes on, it becomes clear that Josef is not who he says, and his intentions are not at all pure. The directorial debut of Patrick Brice and produced by Jason Blum (PARANORMAL ACTIVITY, INSIDIOUS) and Mark Duplass (SAFETY NOT GUARANTEED), CREEP's intense interplay between its two protagonists upends expectations at every turn. (c) The Orchard",Patrick Brice,Director Not Available,Director Not Available,Romance,R ,9/02/2015,80 minutes,Radius-TWC,Creep,Mark Duplass,Patrick Brice,Writer Not Available,Writer Not Available,2015
Burt Lancaster,Peter Falk,Patrick O'Neal,Jean-Pierre Aumont,Astrid Heeren,Jim Patterson,"Major Falconer (Burt Lancaster) leads his eight battle weary soldiers into the Ardennes Forest for some rest and relaxation. They stay at castle keep, where the eccentric Count wants Falconer to sire an heir with his beautiful wife. Sergeant Rossi (Peter Falk) manages to sleep with the baker's wife. Captain Beckman (Patrick O'Neal) and Lieutenant Amberjack (Tony Bill) are not as fortunate as the troop is attacked by Nazis. Surrounded and outnumbered, the brave soldiers valiantly try to holdout the enemy charge as the bloody conflict ensues towards the end of this action war feature.",Sydney Pollack,Director Not Available,Director Not Available,Romance,R,7/23/1969,105 minutes,Sony Pictures Entertainment,Castle Keep,Daniel Taradash,David Rayfiel,Writer Not Available,Writer Not Available,1969
Anthony Hopkins,Natascha McElhone,Julianne Moore,Diane Venora,Susannah Harker,Joss Ackland,"This unusual biography of the renowned Spanish artist Pablo Picasso is a Merchant-Ivory film. The team of director James Ivory, producer Ismail Merchant, and screenwriter Ruth Prawer Jhabvala has been responsible for many period dramas, including A Room with a View and Howard's End. The story of Picasso's remarkable misanthropy is told as experienced by his mistress Francoise Gilot (Natasha McElhone). Francoise was Picasso's lover from 1944 to 1954, and they had two children together, Claude and Paloma. The film shows Picasso (Anthony Hopkins) as a notorious womanizer, with flashbacks revealing his relationships with his wife Olga (Jane Lapotaire), the artist Dora Marr (Julianne Moore), and Marie-Therese Walter (Susannah Harker), an earthy type who sees the artist only on Sundays. Hopkins powerfully portrays Picasso as an artistic genius with an appalling habit of using and abusing women. He not only cheats on his wife but two-times his mistresses. Francoise has survived an abusive relationship with her father (Bob Peck), and she is 40 years younger than Picasso when they become lovers. The film was supposed to be based on Gilot's book Life with Picasso, but the filmmakers were unable to get the rights to it, so they settled for basing the film on Arianna Huffington's Picasso: Creator and Destroyer. The movie also uses imitations rather than Picasso's real paintings. ~ Michael Betzold, Rovi",James Ivory,Director Not Available,Director Not Available,Romance,R ,9/04/1996,125 minutes,Warner Home Video,Surviving Picasso,Ruth Prawer Jhabvala,Writer Not Available,Writer Not Available,Writer Not Available,1996
Robert John Burke,Bill Sage,Karen Sillas,Elina Lwensohn,Holly Marie Combs,Martin Donovan,"A pair of brothers dodge the law while trying to locate their long-lost father in this third feature from independent New York filmmaker Hal Hartley. Robert John Burke stars as Bill McCabe, a failed computer thief who's just been doublecrossed by his girlfriend and partner. Vowing revenge on the next beautiful blonde he encounters, Bill meets up with his younger brother Dennis (William Sage), a philosophy student concerned about their father William (John A. MacKay). It seems the McCabe paterfamilias was a former major league shortstop who became an anarchist bomber in the 1960s, nearly blowing up the Pentagon. On the run for twenty-three years, William was recently caught by the FBI but escaped again. Based on information from their mother, the McCabes travel to Long Island, where William may be hiding. Along the way, the brothers meet the epileptic Elina (Elina Lowensohn) and her friend Kate (Karen Sillas), a beautiful blonde with whom Bill is instantly smitten. While Dennis figures out that Elina is somehow connected to William, Bill contends with Kate's ex-con husband Jack (Joe Stevens) and Jack's best friend Martin (Martin Donovan), both of whom are also in love with her. ~ Karl Williams, Rovi",Hal Hartley,Director Not Available,Director Not Available,Romance,R,1/01/1992,105 minutes,Zenith Entertainment,Simple Men,Hal Hartley,Writer Not Available,Writer Not Available,Writer Not Available,1992
Marilyn Monroe,Yves Montand,Tony Randall,David Burns,Frankie Vaughan,Wilfrid Hyde-White,"In this George Cukor musical, Marilyn Monroe stars as the lead in a Broadway show that spoofs a famous billionaire (Yves Montand). He plans to have the show shut down immediately--until he becomes instantly smitten with its star.",George Cukor,Director Not Available,Director Not Available,Romance,NR,9/01/1960,119 minutes,20th Century Fox,Let's Make Love,Norman Krasna,Hal Kanter,Writer Not Available,Writer Not Available,1960
Adrien Brody,Mark Ruffalo,Nora Zehetner,Rachel Weisz,Rinko Kikuchi,Maximilian Schell,"When the younger of two notorious sibling con artists announces a plan to go legit, his brother implores him to carry out one last swindle in the eagerly anticipated sophomore feature from Brick writer/director Rian Johnson. Tired of a life on the run, a confidence man who has dedicated his life to the art of the grift decides to call it quits. Despite his plans to leave his criminal past behind, however, the reluctant scammer finds that his brother has masterminded one last scheme to claim the wealth of an eccentric millionaire (Rachel Weisz). With the opportunity to make enough money so that he would be able to live comfortably even if his legitimate endeavors fail, the heretofore unrepentant con man finds it increasingly difficult to refuse his sibling's potentially profitable endeavor. ~ Jason Buchanan, Rovi",Rian Johnson,Director Not Available,Director Not Available,Romance,PG-13 ,5/15/2009,113 minutes,Summit Entertainment,The Brothers Bloom,Rian Johnson,Writer Not Available,Writer Not Available,Writer Not Available,2009
