Cast 1,Cast 2,Cast 3,Cast 4,Cast 5,Cast 6,Description,Director 1,Director 2,Director 3,Genre,Rating,Release Date,Runtime,Studio,Title,Writer 1,Writer 2,Writer 3,Writer 4,Year
Sigourney Weaver,Carrie Henn,Michael Biehn,Paul Reiser,Bill Paxton,William Hope,"Big-budget special effects, swiftly paced action, and a distinct feminist subtext from writer/director James Cameron turned what should have been a by-the-numbers sci-fi sequel into both a blockbuster and a seven-time Oscar nominee. Sigourney Weaver returns as Ellen Ripley, the last surviving crew member of a corporate spaceship destroyed after an attack by a vicious, virtually unbeatable alien life form. Adrift in space for half a century, Ripley grapples with depression until she's informed by her company's representative, Carter Burke (Paul Reiser) that the planet where her crew discovered the alien has since been settled by colonists. Contact with the colony has suddenly been lost, and a detachment of colonial marines is being sent to investigate. Invited along as an advisor, Ripley predicts disaster, and sure enough, the aliens have infested the colony, leaving a sole survivor, the young girl Newt (Carrie Henn). With the soldiers picked off one by one, a final all-female showdown brews between the alien queen and Ripley, who's become a surrogate mother to Newt. Several future stars made early career appearances in Aliens (1986), including Lance Henriksen, Bill Paxton, and Reiser. ~ Karl Williams, Rovi",James Cameron,Director Not Available,Director Not Available,SciFi,R,7/18/1986,138 minutes,20th Century Fox Film Corporat,Aliens,James Cameron,Writer Not Available,Writer Not Available,Writer Not Available,1986
Michael Shannon,Joel Edgerton,Kirsten Dunst,Adam Driver,Sam Shepard,Jaeden Lieberher,"Michael Shannon, Joel Edgerton, and Kirsten Dunst star in writer/director Jeff Nichols' drama about a father and his eight-year-old son who go on the lam upon discovering that the boy possesses mysterious powers. ~ Jason Buchanan, Rovi",Jeff Nichols,Director Not Available,Director Not Available,SciFi,PG-13 ,3/18/2016,111 minutes,Warner Bros. Pictures,Midnight Special,Jeff Nichols,Writer Not Available,Writer Not Available,Writer Not Available,2016
Vin Diesel,Radha Mitchell,Cole Hauser,Keith David,Claudia Black,Lewis Fitz-Gerald,"In this science fiction thriller, a spaceship is transporting a disparate group of people to a far-away galactic outpost called New Mecca. Mechanical failures cause the craft to crash-land on an abandoned planet that has three suns and no night. The only member of the crew to survive is junior pilot Carolyn Fry (Radha Mitchell), while the passengers who climb from the wreckage include a police officer (Cole Hauser) and the prisoner he's transporting, Riddick (Vin Diesel). As Fry and the other survivors survey the abandoned dwellings of the desert world while trying to decide what to do next, one of them is killed by a mutant creature living in an abandoned mining site. The vicious and bloodthirsty mutants, who live underground, have killed all previous inhabitants of the planet; they cannot stand sunlight, but research reveals that the planet has a total eclipse every 22 years, and the latest one is due any moment. Pitch Black was directed by David N. Twohy, who also made the sci-fi cult item, The Arrival. ~ Mark Deming, Rovi",David Twohy,Director Not Available,Director Not Available,SciFi,R ,2/18/2000,108 minutes,Gramercy Pictures/ USA Films,Pitch Black,Jim Wheat,Ken Wheat,David Twohy,Writer Not Available,2000
John Travolta,Kyra Sedgwick,Forest Whitaker,Jeffrey DeMunn,Robert Duvall,Richard Kiley,"A small-town auto mechanic of average intelligence suffers a mysterious mishap and suddenly becomes the world's smartest man in this touching, some say, Capra-esque drama. George Malley is the mechanic. He is well liked in his community but no one would ever mistake him for a genius. For a long time he has secretly loved Lace, an attractive single mother who pays him little heed. George's extraordinary change happens when he steps outside during his 37 birthday party and gets zapped by a brilliant flash of heavenly light that may or may not have been caused by a UFO. He returns to the festivities a brilliant, curious fellow who is able to use nearly all of his brain's potential rather than the measly 10% most of us use. Not only can he learn and retain knowledge at an unbelievable rate, he also has psycho-kinetic powers to move things with his will. He can even predict earthquakes. Much of the movie centers on the ways in which people react to the new and improved George. Most people are unable to deal with his intelligence and avoid him. The FBI comes to suspiciously investigate him. Fortunately, George's best friend Nate remains loyal as does the town doctor. Lace also comes round and begins falling in love with him. But then the doctor discovers something about George's condition and the story takes a tragic turn.",Jon Turteltaub,Director Not Available,Director Not Available,SciFi,PG,7/05/1996,124 minutes,Disney,Phenomenon,Gerald DiPego,Writer Not Available,Writer Not Available,Writer Not Available,1996
Michelle Nicastro,Douglas Sills,Jake Williamson,Christy Landers,Joey Camen,Steve Vinovich,"The third film in the Swan Princess children's series, The Mystery of the Enchanted Treasure offers another animated musical adventure of magic and romance. When swan princess Odette is captured by the vile sorceress Zelda, Prince Derek vows to get her back at any cost. But the price may be higher than even he is willing to pay, as Zelda's demand for Odette's return is the Forbidden Arts -- a treasure that would grant the witch unlimited powers and rule over the kingdom. ~ Sandra Bencic, Rovi",Richard Rich,Director Not Available,Director Not Available,SciFi,G,6/01/1997,73 minutes,Sony Pictures Home Entertainment,The Swan Princess II: Escape from Castle Mountain,Brian Nissen,Writer Not Available,Writer Not Available,Writer Not Available,1997
Jordan Christopher Michael,Sandy Baron,Mary Woronov,Meat Loaf,Drew Barrymore,Michael J. Pollard,"This allegorical comedy from scriptwriter Joe Minion (After Hours, Vampire's Kiss) offers a unique twist on the standard road movie formula. It tells the story of a young boy named Gus who grows sick and tired of parental squabbles and decides to steal his dad's red Mustang and hit the highway on a cross-country journey. The country presented in this film, however, is not the U.S., but a fictional land with states such as Bergen and Essex - a land with parallels to a giant board game. While on the road, Gus spots a billboard inviting him to play the ""Motorama"" game, a promotional effort by a major gas station that promises winners $500 million dollars. In order to win, one simply has to collect enough game cards from Chimera gas stations all over the country to spell out the word ""Motorama."" As Gus approaches his goal of collecting all eight letters, he has assorted adventures, many of them strange and a few that are distinctly unpleasant. The film features cameos from several notable cult favorites, including character players Jack Nance and Dick Miller, actress Drew Barrymore, and even the pop singer Meat Loaf.",Barry Shils,Director Not Available,Director Not Available,SciFi,R,3/28/1992,90 minutes,Sony Pictures Home Entertainment,Motorama,Joseph Minion,Writer Not Available,Writer Not Available,Writer Not Available,1992
Hugh Jackman,Dakota Goyo,Anthony Mackie,Evangeline Lilly,Kevin Durand,Hope Davis,"A gritty, white-knuckle, action ride set in the near-future where the sport of boxing has gone high-tech, Real Steel stars Hugh Jackman as Charlie Kenton, a washed-up fighter who lost his chance at a title when 2000-pound, 8-foot-tall steel robots took over the ring. Now nothing but a small-time promoter, Charlie earns just enough money piecing together low-end bots from scrap metal to get from one underground boxing venue to the next. When Charlie hits rock bottom, he reluctantly teams up with his estranged son Max (Dakota Goyo) to build and train a championship contender. As the stakes in the brutal, no-holds-barred arena are raised, Charlie and Max, against all odds, get one last shot at a comeback. -- (C) Dreamworks",Shawn Levy,Director Not Available,Director Not Available,SciFi,PG-13 ,10/07/2011,126 minutes,Walt Disney Pictures,Real Steel,John Gatins,Writer Not Available,Writer Not Available,Writer Not Available,2011
Kristy Swanson,William Ragsdale,Meshach Taylor,Terry Kiser,Stuart Pankin,Cynthia Harris,"Basically a retooling of the original Mannequin, this sequel begins with a medieval European maid (Kristy Swanson) who is separated from her lover by an evil queen. More than 1000 years after the queen imprisons her, she is revived by a contemporary window-dresser (William Ragsdale), the reincarnation of the prince she loved.",Stewart Raffill,Director Not Available,Director Not Available,SciFi,PG,4/15/2008,98 minutes,Live Home Video,Mannequin 2: On the Move,David Isaacs,Ken Levine,Edward N. Rugoff,Betsy Israel,1991
Sanaa Lathan,Raoul Bova,Lance Henriksen,Ewen Bremner,Colin Salmon,Tommy Flanagan,"Directed by Paul W.S. Anderson, Alien vs. Predator follows billionaire Charles Bishop Weyland (Lance Henriksen) and his team of drillers, scientists, and archaeologists, to an obscure pyramid site in Antarctica. Among the icy ruins, allegedly, lies the proof of an empire predating humankind. Once there, however, the group finds more than ancient sarcophaguses and hieroglyphics; rather, their discovery consists of dismembered human skeletons and fossilized remains of the alien creatures that appear to have violently burst out of their chests. Even more horrifying is the evidence suggesting that the aliens may still exist. Indeed, there are aliens below the pyramids, but an equal threat looms above: three Predators, all on the verge of manhood, are engaged in a gruesome rite of passage -- every hundred years, young Predators must travel to Earth and take on a hunting ritual in order to complete the transition to adulthood or die in the process. Before long, the humans find themselves battling for their own lives as the Predators and aliens continue their fight for superiority. The film also features Sanaa Lathan, Raoul Bova, Ewen Bremmer, Colin Salmon, and Agathe de la Boulaye.",Paul W.S. Anderson,Director Not Available,Director Not Available,SciFi,PG-13 ,8/13/2004,87 minutes,20th Century Fox,AVP - Alien Vs. Predator,Paul W.S. Anderson,Writer Not Available,Writer Not Available,Writer Not Available,2004
Dennis Quaid,Shawn Doyle,Andre Braugher,Elizabeth Mitchell,Noah Emmerich,Melissa Errico,"What if you had the chance to travel back in time and change just one event in your life? What would it be? For John Sullivan, there is no question. He would undo the events of October 12, 1969, when the out-of-control Bruxton fire took the life of his father, a heroic firefighter. Ever since he was a kid, John dreamed of being able to stop the tragedy of that fateful day, which set into motion the anger and loneliness that have haunted his adult life as a cop in the 1990s. Now John may get exactly what he has wished for, and more than he bargained for. One day before the anniversary of his father's death, in the midst of the spectacular storm known as the aurora borealis, John Sullivan discovers in the house he inherited his father's old ham radio and begins to play with it. Through the electrical static, he finds himself talking to a man who claims to be a firefighter and who appears to be awaiting the World Series of 1969. Is John really talking to his own living father on the very same day, in the very same house, but exactly three decades ago? At first neither can believe it, but soon John is carrying on an all-night conversation with his young father, sharing for the first time his deep love and regret over his future death. Yet John realizes that now he may be able to change all that. By alerting Frank to the mistake that cost him his life the first time around, John saves his youthful father from dying in the Bruxton fire. On October 12, 1999, John Sullivan discovers that he now has photographs on his walls of his father as a gray-haired man. By changing the past, the Sullivans have forged a new present. John is ecstatic with his new memories of his father- until he discovers other things have been altered. Subtle changes caused by his father's survival have led to a string of unsolved serial homicides, including the grisly murder of John's mother. Now Frank and John must race against the clock-divided by three decades and connected only by a radio-to prevent a murder that will seal their destinies. And each time Frank changes something in his universe, John wakes up to a whole new reality.",Gregory Hoblit,Director Not Available,Director Not Available,SciFi,PG-13 ,4/28/2000,121 minutes,New Line Cinema,Frequency,Toby Emmerich,Writer Not Available,Writer Not Available,Writer Not Available,2000
Kate Beckinsale,Stephen Rea,Michael Ealy,Theo James,India Eisley,Sandrine Holt,"Kate Beckinsale, star of the first two films, returns in her lead role as the vampire warrioress Selene, who escapes imprisonment to find herself in a world where humans have discovered the existence of both Vampire and Lycan clans, and are conducting an all-out war to eradicate both immortal species. -- (C) Official Site",Bjrn Stein,Mns Mrlind,Director Not Available,SciFi,R ,1/20/2012,88 minutes,Screen Gems,Underworld: Awakening,John Hlavin,Allison Burnett,J. Michael Straczynski,Len Wiseman,2012
Joshua Zuehkle,Alex English,Gregory Peck,Jamie Lee Curtis,William L. Petersen,Joshua Zuehlke,"Young boy Chuck chooses to boycott his Little League baseball games to protest nuclear proliferation in this drama. His example is soon followed by a number of high-profile professional athletes, led by pro-basketball player Amazing Grace Smith, with whom Chuck develops a close friendship.",Mike Newell,Director Not Available,Director Not Available,Kids&Family,PG ,10/04/2011,115 minutes,HBO Video,Amazing Grace and Chuck,Naomi Foner,Ronald Bass,David Field,Writer Not Available,1987
Ethan Hawke,Klaus Maria Brandauer,Seymour Cassel,Susan Hogan,James Remar,Bill Moseley,"Set in the Yukon Territory in 1897,""White Fang"" is the story of a young man and a wolf.",Randal Kleiser,Director Not Available,Director Not Available,Kids&Family,PG,1/18/1991,109 minutes,Buena Vista Pictures,White Fang,Jeanne Rosenberg,Nick Thiel,David Fallon,Writer Not Available,1991
Craig T. Nelson,Holly Hunter,Samuel L. Jackson,Jason Lee,Dominique Louis,Teddy Newton,"Once one of the world's top masked crime fighters, Bob Parr--known to all as ""Mr. Incredible""--fought evil and saved lives on a daily basis. But now fifteen years later, Bob and his wife--a famous superhero in her own right--have adopted civilian identities and retreated to the suburbs to live normal lives with their three kids. Now he's a clock-punching insurance claims adjuster fighting boredom and a bulging waistline. Itching to get back into action, Bob gets his chance when a mysterious communication summons him to a remote island for a top-secret assignment.",Brad Bird,Director Not Available,Director Not Available,Kids&Family,PG ,11/05/2004,115 minutes,Buena Vista Pictures,The Incredibles,Brad Bird,Writer Not Available,Writer Not Available,Writer Not Available,2004
Tcheky Karyo,Douce the Bear,Bart the Bear,Jack Wallace,Doc the Bear,Griz the Bear,Acclaimed account of an orphaned grizzly cub and a wounded Kodiak bear that join forces in their struggle for survival in 1885 Canada.,Jean-Jacques Annaud,Director Not Available,Director Not Available,Kids&Family,PG ,10/25/1989,96 minutes,Sony Pictures Home Entertainment,The Bear,Grard Brach,Writer Not Available,Writer Not Available,Writer Not Available,1989
John Paul DeJoria,Dan Aykroyd,Arianna Huffington,Robert Kennedy Jr.,Cast Not Available,Cast Not Available,"Born into impoverished beginnings in East LA, at times homeless and living in his car, John Paul DeJoria spent his early adulthood in and out of motorcycle gangs including the Satan Slaves and Hells Angels. After losing his brother in a horrific motorcycle accident, JP transformed his life and built a wildly successful line of hair care products with artist Paul Mitchell. Proving his success wasn't just a fluke, JP then created the largest tequila brand in the world - Patron. GOOD FORTUNE reveals the success secret of one of America's most celebrated entrepreneurs: giving back. A modern day Robin Hood (without the stealing), JP spends his life creating back-to-work programs for the homeless, fighting whale poachers in the Arctic and working on over 100 other philanthropic ventures. His motto is ""Success unshared is failure."" The son of Greek immigrants, JP is a pioneer of ""conscious capitalism"" (also known as ""the triple bottom line"" - people, planet and profit). GOOD FORTUNE tells his inspiring life story and shows how he uses business to make the world a better place.",Joshua Tickell,Rebecca Harrell Tickell,Director Not Available,Kids&Family,NR,6/23/2017,90 minutes,Paladin,Good Fortune,Johnny O'Hara,Writer Not Available,Writer Not Available,Writer Not Available,2017
Peter O'Toole,Samantha Morton,John Lynch,Peter Dinklage,Jonathan Mason,Hester Odgers,"Set in 1938, a loyal collie travels more than 1,000 miles from northern Scotland to Yorkshire to return to her young friend. The dog, having been sold to a wealthy Duke because the boy's father was out of work, runs away and braves starvation and treacherous conditions to follow the pull of her heart toward the family who loves her.",Charles Sturridge,Director Not Available,Director Not Available,Kids&Family,PG ,9/01/2006,100 minutes,Roadside/Samuel Goldwyn Films,Lassie,Charles Sturridge,Writer Not Available,Writer Not Available,Writer Not Available,2006
Anna Gunn,Chandler Canterbury,Frances O'Connor (II),Dylan Matzke,Daveigh Chase,Cast Not Available,"An 8-year-old boy dedicates his life to helping children rendered homeless by Hurricane Charley, and learns that you can't put a price tag on life's greatest gifts in this inspirational drama based on actual events. Dejected at the images of families whose lives were uprooted by the disaster, Zach Bonner uses his trusty wagon to collect essential items that will help them get back on their feet. When the media spotlight's Zach's benevolent endeavors, the selfless seizes the opportunity to launch his own charity, dubbed the Little Red Wagon Foundation. Later, Zach encounters a widow and her son who were rendered homeless by the story, and vows to draw attention to their plight by embarking on a cross country walk. Despite his mother's trepidations about the journey and his teenage sister's growing resentment over being stuck at the center of a media circus, Zach sets out on a journey that will transform not just his own life, but also the lives of everyone he encounters. ~ Jason Buchanan, Rovi",David Anspaugh,Director Not Available,Director Not Available,Kids&Family,PG ,10/05/2012,104 minutes,Phase 4 Films,Little Red Wagon,Patrick Sheane Duncan,Writer Not Available,Writer Not Available,Writer Not Available,2012
James Whitmore,Michele Mariana,Gary Krug,Chris Ritchie,Carol Edelman,John Hennigan,"Will Vinton, the stop-motion animation whiz who brought us The California Raisins, is the principal creative force behind The Adventures of Mark Twain. A clay-model Twain, voiced by James Whitmore, sets out in a hot-air balloon to find Halley's Comet. Joining the waspish humorist on his journey are some of his favorite creations, including Tom Sawyer, Becky Thatcher and Huckleberry Finn. As the balloon ascends further into the sky, we are treated to animated dramatization of such Twain classics as ""The Celebrated Jumping Frog of Calaveras County."" Though brilliantly conceived and executed, Adventures of Mark Twain might have been even more effective had it been shortened by ten minutes or so.",Will Vinton,Director Not Available,Director Not Available,Kids&Family,G,3/01/1985,86 minutes,Eureka Entertainment Ltd,The Adventures of Mark Twain,Susan Shadburne,Writer Not Available,Writer Not Available,Writer Not Available,1985
Chris Pratt,Elizabeth Banks,Will Arnett,Morgan Freeman,Will Ferrell,Charlie Day,"""The LEGO (R) Movie"" is the first-ever, full-length theatrical LEGO (R) adventure. The original 3D computer animated story follows Emmet (Chris Pratt) an ordinary, rules- following, perfectly average LEGO minifigure who is mistakenly identified as the most extraordinary person and the key to saving the world. He is drafted into a fellowship of strangers on an epic quest to stop an evil tyrant, a journey for which Emmet is hopelessly and hilariously underprepared. (c) Warner Bros",Phil Lord,Christopher Miller,Chris McKay,Kids&Family,PG ,2/07/2014,101 minutes,Warner Bros. Pictures,The LEGO Movie,Dan Hageman,Roy Lee,Christopher Miller,Phil Lord,2014
Kristin Chenoweth,Matthew Modine,Olesya Rulin,Joey King,Eddie Hassell,Shirley Jones,When a 16-year-old girl becomes fed-up with her self-absorbed family's lack of attention and affection - she decides to take matters into her own hands - and take her parents hostage.(c) Official Site,Benjamin Epps,Director Not Available,Director Not Available,Kids&Family,R ,3/29/2013,96 minutes,Arc Entertainment,Family Weekend,Matt K. Turner,Writer Not Available,Writer Not Available,Writer Not Available,2013
Jim Carrey,Carla Gugino,Angela Lansbury,Ophelia Lovibond,Madeline Carroll,Maxwell Perry Cotton,"In this family comedy, Jim Carrey is Mr. Popper, a driven businessman who is clueless when it comes to the important things in life - until he inherits six penguins. Popper's penguins turn his swank New York apartment into a snowy winter wonderland - and the rest of his life upside-down. Filmed on a refrigerated soundstage with real Emperor Penguins, Mr. Popper's Penguins is a contemporary adaptation of the classic book. -- (C)Fox",Mark Waters (VIII),Director Not Available,Director Not Available,Kids&Family,PG ,6/17/2011,97 minutes,20th Century Fox,Mr. Popper's Penguins,John Morris (XIX),Sean Anders,Jared Stern,Writer Not Available,2011
Douglas Fairbanks,Philharmonia Orchestra,Julanne Johnston,Snitz Edwards,Anna May Wong,Julianne Johnston,"Douglas Fairbanks is at his most graceful and charismatic in one of the classic silent films of the 1920s. As the thief of Baghdad, his movements are dance-like -- nothing like the athletics he performed in most of his other films. In this Arabian take, the thief ignores the holy teachings and sneaks into the palace of the Caliph (Brandon Hurst). All thoughts of robbery slip away, however, when he sees the beautiful princess (Julanne Johnston). Princes have come from many faraway lands to win the princess' hand (and it's amusing to watch her face growing ever more alarmed at their arrival, because each one is uglier than the last). The thief disguises himself as a prince and the princess falls in love with him. After having a pang of conscience, the thief confesses all to the Holy Man (Charles Belcher), who sends him to find a magic chest. He braves many obstacles to get it, and when he returns he discovers that the Mongol Prince (Sojin) has taken over the city. Using the chest, the reformed thief creates armies of men out of nothingness and recaptures the city. He then uses the cloak of invisibility to spirit the princess away on a magic carpet. Fairbanks stole some of the special effects for his film from Fritz Lang's Der Mde Tod, which he had purchased for American distribution. The Thief of Baghdad, with its look of unrealistic beauty (courtesy of art director William Cameron Menzies), was not fully appreciated in its day. Because of its huge cost (two million dollars -- a real fortune in those days), it made little money. After that, Fairbanks stuck closer to the swashbuckling persona he felt his audience wanted.",Raoul Walsh,Director Not Available,Director Not Available,Kids&Family,NR,3/18/1924,153 minutes,United Artists,The Thief of Bagdad,Douglas Fairbanks,Lotta Woods,Writer Not Available,Writer Not Available,1924
Jack Black,Dustin Hoffman,Angelina Jolie,Ian McShane,Jackie Chan,Lucy Liu,"A clumsy panda bear becomes an unlikely kung fu hero when a treacherous enemy spreads chaos throughout the countryside in this animated martial arts adventure featuring the voices of Jack Black, Dustin Hoffman, Angelina Jolie, and Jackie Chan. On the surface, Po (voice of Black) may look like just another portly panda bear, but beneath his fur he bears the mark of the chosen one. By day, Po works faithfully in his family's noodle shop, but by night he dreams of becoming a true master of the martial arts. Now an ancient prophecy has come to pass, and Po realizes that he is the only one who can save his people from certain destruction. With time running short and malevolent snow leopard Tai Lung (Ian McShane ) closing in, Furious Five legends Tigress (Jolie), Crane (David Cross ), Mantis (Seth Rogen), Viper (Lucy Liu), Monkey (Chan), and their wise sensei, Master Shifu (Hoffman), all draw on their vast knowledge of fighting skills in order to transform a lumbering panda bear into a lethal fighting machine. Now, if the noble Po can master the martial arts and somehow transform his greatest weaknesses into his greatest strengths, he will fulfill his destiny as the hero who saved his people during their darkest hour. ~ Jason Buchanan, Rovi",John Stevenson,Mark Osborne,Director Not Available,Kids&Family,PG ,6/06/2008,88 minutes,Paramount Pictures,Kung Fu Panda,Jonathan Aibel,Glenn Berger,Writer Not Available,Writer Not Available,2008
