Cast 1,Cast 2,Cast 3,Cast 4,Cast 5,Cast 6,Description,Director 1,Director 2,Director 3,Genre,Rating,Release Date,Runtime,Studio,Title,Writer 1,Writer 2,Writer 3,Writer 4,Year
Cast Not Available,Cast Not Available,Cast Not Available,Cast Not Available,Cast Not Available,Cast Not Available,"A Netflix original short documentary, set in Aleppo, Syria and Turkey in early 2016. As the violence intensifies, The White Helmets follows three volunteer rescue workers as they put everything on the line to save civilians affected by the war, all the while wracked with worry about the safety of their own loved ones. Moving and inspiring, The White Helmets (directed by Academy Award (R)-nominated director Orlando von Einsiedel and producer Joanna Natasegara) is both a snapshot of the harrowing realities of life for ordinary Syrians who remain in the country, and a humbling portrait of the power of the human spirit.",Orlando Von Einsiedel,Director Not Available,Director Not Available,Documentary,NR,9/16/2016,40 minutes,Grain Media,The White Helmets,Writer Not Available,Writer Not Available,Writer Not Available,Writer Not Available,2016
Leonardo DiCaprio,Barack Obama,Bill Clinton,John Kerry,Elon Musk,Pope Francis,"This epic documentary follows Leonardo DiCaprio as he travels the world to examine firsthand the effects of climate change, and to learn more about possible ways to prevent catastrophic damage that could make the Earth unsustainable for human life. During his journey, he speaks with such influential figures as President Barack Obama, Pope Francis and tech innovator Elon Musk, and makes a speech before the United Nations calling for greater action on this issue.",Fisher Stevens,Director Not Available,Director Not Available,Documentary,PG,10/30/2016,96 minutes,Appian Way Productions,Before the Flood,Mark Monroe,Writer Not Available,Writer Not Available,Writer Not Available,2016
Kassim Ouma,Tom Moran,Russell Peltz,Jermain Taylor,Cast Not Available,Cast Not Available,"Plenty of professional sports stars have had to overcome adversity to achieve success, but few have had to struggle against the harrowing circumstances that met Kassim ""the Dream"" Ouma in his childhood. Born in Uganda in 1978, Ouma was one of 13 siblings; he was born into poverty and sent to a boarding school where, at the age of six, he was abducted along with most of his classmates by rebel soldiers under the leadership of Yoweri Museveni. The soldiers taught Ouma how to kill, maim and torture others, and he was forced to inflict punishment under the threat of death. Museveni became Uganda's president in 1986 and Ouma was drafted into the military as soon as he came of age; while a soldier, he began taking boxing lessons. Ouma had a great natural talent as a fighter, and became a star on the army's boxing team. But Ouma dreamed of a better life, and when Uganda's national team traveled to compete in America, he defected, seeking asylum in the United States. Despite having no money and not speaking a word of English, 18-year-old Ouma was welcomed by Africans in the American boxing community, and manager Tom Moran took Ouma under his wing and into his home. Ouma went on to become Light Middleweight champion and a top middleweight contender in a professional career that saw him win 24 of his 29 fights. Filmmaker Kief Davidson tells Ouma's remarkable true story in the documentary Kassim the Dream, in which Ouma talks about his ravaged childhood, coming to America, his return to Uganda, and how boxing became his therapy as he deals with the demons of his past. Kassim the Dream was an official selection at the 2008 Tribeca Film Festival.",Kief Davidson,Director Not Available,Director Not Available,Documentary,NR,5/15/2009,87 minutes,IFC Films,Kassim the Dream,Kief Davidson,Writer Not Available,Writer Not Available,Writer Not Available,2009
Suzette Gondry,Jean-Yves Gondry,Cast Not Available,Cast Not Available,Cast Not Available,Cast Not Available,"Filmmaker Michel Gondry turns from the playful semi-surrealism of Eternal Sunshine of the Spotless Mind and The Science of Sleep to the personal story of a beloved family member in this documentary. Suzette Gondry is Michel's aunt and a retired schoolteacher; she educated children in rural communities in France from 1952 to 1986. While Suzette was committed to the education of all her students, she was a particularly close with one in particular -- her son, Jean-Yves, with whom she's had a loving but sometimes combative relationship. Michel accompanies Suzette on a journey in which she visits the many schools where she taught -- or the sites where those schools once stood -- and speaks of her experiences. She also meets some of her former students, and it's clear they recall Suzette as a woman with a kind heart but a strong will, and her determination earned her the enmity of a few of her charges. L'Epine dans le Coeur (aka The Thorn in the Heart) was an official selection at the 2009 BFI London Film Festival. ~ Mark Deming, Rovi",Michel Gondry,Director Not Available,Director Not Available,Documentary,NR,4/02/2010,86 minutes,Oscilloscope Pictures,The Thorn in the Heart,Michel Gondry,Writer Not Available,Writer Not Available,Writer Not Available,2010
Linda Hunt,Cast Not Available,Cast Not Available,Cast Not Available,Cast Not Available,Cast Not Available,"After enduring WWII-era brutalization by Hitler's Nazi Party and decades of repressive Soviet dictatorship, the tiny Eastern European nation of Estonia began to declare its independence from Communist rule in the late '80s. Over a five-year period, beginning in 1986, hundreds of thousands of Estonians began to systematically and repeatedly gather in public venues to collectively sing illegal patriotic songs, declaring their desire for national independence but never resorting to violence amid their protests. It was no coincidence that Estonia subsequently became one of the first nations to break away from the Soviet Union in the events leading up to the fall of the Iron Curtain. The documentary The Singing Revolution chronicles this extraordinary yet seldom-told chain of events. ~ Nathan Southern, Rovi",Maureen Castle Tusty,Mike Majoros,James Tusty,Documentary,G,12/07/2007,94 minutes,Mountain View Productions,The Singing Revolution,Maureen Castle Tusty,Mike Majoros,James Tusty,Writer Not Available,2007
Jonathan Pryce,Tacita Dean,William Firebrace,Dan Gretton,Barbara Hui,Arthur Lubow,"A richly textured essay film on landscape, art, history, life and loss, Patience (After Sebald) offers a unique exploration of the work and influence of internationally acclaimed writer W.G. Sebald (1944 - 2001). With contributions from major writers, artists and filmmakers, including Adam Philips, Robert Macfarlane, Rick Moody and Tacita Dean, the film is structured around a walk through coastal East Anglia, the same path followed by Sebald in his ground-breaking book, ""The Rings of Saturn."" Directed by the Grierson Award winning director of Joy Division, Patience is the first film on this important and vital writer, and marks ten years since his untimely death. -- (C) Cinema Guild",Grant Gee,Director Not Available,Director Not Available,Documentary,NR,5/09/2012,82 minutes,Cinema Guild,Patience (After Sebald),Writer Not Available,Writer Not Available,Writer Not Available,Writer Not Available,2012
Russell Crowe,Kelly Slater,Koby Abberton,Sunny Abberton,Laird Hamilton,Bruce Irons,"""Bra Boys"" documents the cultural evolution of the inner-Sydney beach-side suburb of Maroubra and the social struggle of its youth--the tattooed and much maligned surf community known as the Bra Boys. Explores their success in professional big wave surfing, their international reputation for hard partying and rough justice, and touches on their running battle with authorities. The film shows their absolute reliance on one another to fit into a society in which they are displaced and, at times, disinterested. Follows how the evolution of Maroubra, coupled with the historical stigma associated with Australia's rebellious surf community, has contributed to their social displacement.",Sunny Abberton,Director Not Available,Director Not Available,Documentary,R,8/12/2008,86 minutes,Slowhand Cinema Releasing,Bra Boys,Stuart Beattie,Sunny Abberton,Writer Not Available,Writer Not Available,2008
Warren Christie,Lloyd Owen,Ryan Robbins,Michael Kopsa,Andrew Airlie,Cast Not Available,"Officially, Apollo 17, launched December 17th, 1972 was the last manned mission to the moon. But a year later, in December of 1973, two American astronauts were sent on a secret mission to the moon funded by the US Department of Defense. What you are about to see is the actual footage which the astronauts captured on that mission. While NASA denies its authenticity, others say it's the real reason we've never gone back to the moon. -- (C) Official Site",Gonzalo Lpez-Gallego,Director Not Available,Director Not Available,SciFi,PG-13,9/02/2011,88 minutes,The Weinstein Company,Apollo 18,Brian Miller,Writer Not Available,Writer Not Available,Writer Not Available,2011
William Shatner,DeForest Kelley,James Doohan,George Takei,Walter Koenig,Nichelle Nichols,"Star Trek II ended with Spock presumed dead, but this film reveals that his consciousness survives within McCoy. Spock's body and consciousness must be quickly reunited or his death will be certain, and McCoy will be left insane. Racing against time, Kirk makes painful sacrifices trying to save his friends.",Leonard Nimoy,Director Not Available,Director Not Available,SciFi,PG,6/01/1984,105 minutes,Paramount Pictures,Star Trek III - The Search for Spock,Harve Bennett,Writer Not Available,Writer Not Available,Writer Not Available,1984
Geraint Wyn Davies,Kari Matchett,Neil Crone,Matthew Ferguson,Lindsey Connell,Grace Lynn Kung,"In this Canadian-filmed sequel to (what else?) The Cube, eight strangers awaken in a cube-shaped room with no idea of where they've come from or how they arrived. All they do know is that they've been plunged into a fourth-dimensional netherworld where all physical laws seem to be made up as they go along. Presented with cryptic clues as to the nature of their plight, the tiny group desperately tries to find a way out of their constantly shape-shifting environment, certain that if they don't escape, they will die slow but spectacular deaths. First shown at the Fantasy Filmfest in Munich, Germany, in the summer of 2002, Cube 2: Hypercube bounced around the sci-fi festival circuit until its American cable TV debut over the Sci-Fi Channel on April 5, 2003.",Andrzej Sekula,Director Not Available,Director Not Available,SciFi,R,4/15/2003,94 minutes,Ghost Logic,Cube 2 - Hypercube,Sean Hood,Ernie Barbarash,Lauren McLaughlin,Writer Not Available,2003
Ellen Barkin,Jimmy Smits,JoBeth Williams,Lorraine Bracco,Perry King,Tony Roberts,"In Blake Edwards' screwball comedy Switch, a sleazy male chauvinist (Perry King) is killed by his ex-girlfriends, and in order to get into heaven, he must return to Earth to find a woman who loves him. The twist is, he is sent back not as a man, but as a gorgeous, sexy woman (Ellen Barkin).",Blake Edwards,Director Not Available,Director Not Available,SciFi,R ,5/10/1991,103 minutes,HBO Video,Switch,Blake Edwards,Writer Not Available,Writer Not Available,Writer Not Available,1991
Douglas Fairbanks,Philharmonia Orchestra,Julanne Johnston,Snitz Edwards,Anna May Wong,Julianne Johnston,"Douglas Fairbanks is at his most graceful and charismatic in one of the classic silent films of the 1920s. As the thief of Baghdad, his movements are dance-like -- nothing like the athletics he performed in most of his other films. In this Arabian take, the thief ignores the holy teachings and sneaks into the palace of the Caliph (Brandon Hurst). All thoughts of robbery slip away, however, when he sees the beautiful princess (Julanne Johnston). Princes have come from many faraway lands to win the princess' hand (and it's amusing to watch her face growing ever more alarmed at their arrival, because each one is uglier than the last). The thief disguises himself as a prince and the princess falls in love with him. After having a pang of conscience, the thief confesses all to the Holy Man (Charles Belcher), who sends him to find a magic chest. He braves many obstacles to get it, and when he returns he discovers that the Mongol Prince (Sojin) has taken over the city. Using the chest, the reformed thief creates armies of men out of nothingness and recaptures the city. He then uses the cloak of invisibility to spirit the princess away on a magic carpet. Fairbanks stole some of the special effects for his film from Fritz Lang's Der Mde Tod, which he had purchased for American distribution. The Thief of Baghdad, with its look of unrealistic beauty (courtesy of art director William Cameron Menzies), was not fully appreciated in its day. Because of its huge cost (two million dollars -- a real fortune in those days), it made little money. After that, Fairbanks stuck closer to the swashbuckling persona he felt his audience wanted.",Raoul Walsh,Director Not Available,Director Not Available,SciFi,NR,3/18/1924,153 minutes,United Artists,The Thief of Bagdad,Douglas Fairbanks,Lotta Woods,Writer Not Available,Writer Not Available,1924
Robin Williams,Dustin Hoffman,Julia Roberts,Bob Hoskins,Maggie Smith,Caroline Goodall,"Steven Spielberg filters J. M. Barrie's Peter Pan through a distinctly 1990s sensibility in Hook. Peter Pan has become Peter Banning (Robin Williams), a 40-year-old mergers and acquisitions lawyer with a permanent scowl on his face and a cellular phone in his belt. Banning has lost any memory of being Peter Pan, and he is also in danger of losing his wife Moira (Caroline Goodall) and two children, Jack (Charlie Korsmo) and Maggie (Amber Scott). Peter and his family travel to London to visit Granny Wendy (Maggie Smith) who recalls Peter's lost youth and asks him, ""Peter, dear, don't you know who you are?"" With Peter's children asleep in the same bedroom where the original Peter Pan story began, there is a blinding flash. Peter comes into the room to discover a note from Captain Hook (Dustin Hoffman), informing Peter that he has kidnapped his children. Granny Wendy now tells him who he really is and encourages him to re-discover his happy thoughts, transform himself into the Peter Pan of the past, and go rescue his children. With the encouragement of Tinkerbell (Julia Roberts), Peter recalls the birth of his son and once again takes wing. Then it's off to Never Land to rescue his kids. ~ Paul Brenner, Rovi",Steven Spielberg,Director Not Available,Director Not Available,SciFi,PG,12/11/1991,136 minutes,TriStar Pictures,Hook,Malia Scotch Marmo,James V. Hart,Writer Not Available,Writer Not Available,1991
Charlotte Gainsbourg,Gael Garca Bernal,Alain Chabat,Miou-Miou,Pierre Vaneck,Emma de Caunes,"Inventive Eternal Sunshine of the Spotless Mind director Michel Gondry takes a surreal trip through the mind of an introverted but wildly creative man whose attempts to balance his colorful dreams with his stark reality are complicated by the arrival of a beautiful woman into his life. Shy St (C)phane (Gael Garca Bernal) has returned to his childhood hometown to accept a new job. When the prospective employment offer fails to live up to expectations, however, St (C)phane is at least comforted by the close bond he has formed with his creative-thinking neighbor St (C)phanie (Charlotte Gainsbourg). Their blossoming romance finally awakens the sleeping confidence that the withdrawn St (C)phane was previously capable of displaying only in his dreams, but St (C)phane and St (C)phanie find their relationship challenged when lingering insecurities prompt the smitten visionary to confront an old dilemma that can't be solved by the Science of Sleep. ~ Jason Buchanan, Rovi",Michel Gondry,Director Not Available,Director Not Available,SciFi,R ,6/18/2006,106 minutes,Warner Independent Pictures,The Science of Sleep,Michel Gondry,Writer Not Available,Writer Not Available,Writer Not Available,2006
Tommy Kirk,Annette Funicello,Elsa Lanchester,Harvey Lembeck,Jesse White,Buster Keaton,"Out of the beaches and into the boudoirs go Frankie Avalon, Annette Funicello and the rest of the gang in Pajama Party. Actually, the whole megillah is as innocent as a newborn babe, but there's plenty of smirking and snickering during a wild 'n' wacky girl's slumber party. Frankie Avalon has only a cameo, relinquishing center stage to Tommy Kirk, playing a teenaged Martian (!) studying the lovemaking rituals of Earthlings. Old-timers Buster Keaton, Dorothy Lamour and Elsa Lanchester also weave in and out of the proceedings, with Keaton the only one who doesn't look as though he wishes he were somewhere else. And of course there's good old Harvey Lembeck as good old Eric ""Why Me?"" Von Zipper. Director Don Weis took over for Beach Party's William Asher in Pajama Party, remaining in charge for the ill-fated sequel Ghost in the Invisible Bikini (1966).",Don Weis,Director Not Available,Director Not Available,SciFi,NR,11/11/1964,82 minutes,James H. Nicholson Productions,Pajama Party,Louis M. Heyward,Writer Not Available,Writer Not Available,Writer Not Available,1964
Willy Fritsch,Klaus Pohl,Willie Fritsch,Gustav von Wangenheim,Gerda Maurus,Heinrich Gotho,"This silent presentation tells the story of people who take a trip to the moon and discover water, atmosphere and gold!",Fritz Lang,Director Not Available,Director Not Available,SciFi,NR,10/15/1929,12 minutes,Deutsche Universum Film AG,Frau im Mond (By Rocket to the Moon) (Woman in the Moon),Fritz Lang,Thea von Harbou,Writer Not Available,Writer Not Available,1929
Emily Booth,Christopher Adamson,Norman Lovett,Jodie Shaw,Samuel Butler,Peter McNeil O'Connor,"A tabloid television news magazine host and her ramshackle crew have a gruesome close encounter when they set out to investigate an alien abduction in director Jake West's no-holds-barred splatstick comedy. Cat (Jennifer Evans) and her boyfriend were copulating in a moonlit graveyard when they were abducted by a malevolent gang of extraterrestrials and forced to endure a most unseemly series of highly-intrusive medical tests. Though Cat would eventually find her way back to terra firma, something strange seems to be growing inside of her and the man she was with that night has never been heard from again. When exploitive ""Weird Worlde"" hostess Michelle Fox (Emily Booth) catches wind of the Cat's story, she sees it as the perfect opportunity to resuscitate her failing ratings and get her show back in the spotlight. With keen-eyed cameraman Ricky (Sam Butler), stoned-out sound guy Jack (Peter McNeil O'Connor"", spotty-skinned ufologist Gavin (Jamie Honeybourne) and reenactment actors Candy (Jodie Shaw) and Bruce (Nick Smithers) in tow, the determined television host sets out for the Welsh peninsula where the abduction took place to get the scoop and make a buck. Upon arriving at their remote destination, the crew quickly discovers that Cat, who lives in a decrepit farmhouse with her three inbred brothers, is in an advanced state of pregnancy despite only having been inseminated by the attacking extraterrestrials just days ago. It's not long before the murderous aliens show up at the farmhouse seeking to see what kind of progress their interspecies offspring has made, and as the terrified humans stage a last stand against the interstellar invaders the stage is set for a man-versus-alien bloodbath that threatens to soak the stars in gore. ~ Jason Buchanan, Rovi",Jake West,Director Not Available,Director Not Available,SciFi,R ,10/02/2007,89 minutes,Studio Not Available,Evil Aliens,Jake West,Writer Not Available,Writer Not Available,Writer Not Available,2005
Evelyne Kraft,Danny Lee,Feng Ku,Cast Not Available,Cast Not Available,Cast Not Available,"A powerful earthquake awakens a giant, apelike creature who descends from the mountains into the treacherous jungles of India. Later, an expedition of greedy showmen capture the fearsome beast, bringing him back to civilization!",Ho Meng-hua,Director Not Available,Director Not Available,SciFi,PG-13,3/11/1978,91 minutes,Miramax,Xing xing wang (The Mighty Peking Man) (Colossus of Congo) (Goliathon),Writer Not Available,Writer Not Available,Writer Not Available,Writer Not Available,1978
Julie Christie,Fritz Weaver,Gerrit Graham,Robert Vaughn,Berry Kroeger,Barry Kroger,"A brilliant scientist's marriage is strained by his devotion to his latest project, the creation of an intelligent supercomputer. When this tension drives the scientist to move out, the computer decides to take over the house and impregnate the scientist's wife in this technological horror film.",Donald Cammell,Director Not Available,Director Not Available,SciFi,R,4/08/1977,94 minutes,United Artists,Demon Seed,Robert Jaffe,Roger O. Hirson,Writer Not Available,Writer Not Available,1977
Akira Kubo,Kyoko Ai,Jun Tazaki,Yukiko Kobayashi,Yoshio Tsuchiya,Yukihiko Kobayashi,"From a lunar base of operations, the female Kilaakas lead by their Queen (Kyoko Ai) attach electronic collars to the monsters gathered on Ogaswara Island on the planet Earth. The frenzied females wish to take over the world and unleash Godzilla on New York, Rodan on Moscow, and Mothra on Peking. The terrible trio are joined by Baragon, Anzilla, Wendra, Varan and Spigas in their romp to ruin the major cities of the world. After the monsters have wrought their terrible destruction, things are brought under control by the humans. The invaders send Ghidrah in an attempt to rule the world. The monsters congregate at Mount Fugi for an all-star spectacular bout of memorable monster mayhem in this classic science fiction spectacular.",Ishir Honda,Director Not Available,Director Not Available,SciFi,G,5/23/1969,88 minutes,American International Pictures,Destroy All Monsters,Ishir Honda,Takeshi Kimura & Shinichi Sekizawa,Kaoru Mabuchi,Writer Not Available,1969
Daniel Radcliffe,Emma Watson,Rupert Grint,David Thewlis,Gary Oldman,Alan Rickman,"After directing the first two movies in the Harry Potter franchise, Chris Columbus opted to serve as producer for Harry Potter and the Prisoner of Azkaban, and passed the baton to Y Tu Mam Tambin director Alfonso Cuarn. Though ""immensely popular"" is an understatement when it comes to Harry Potter, Azkaban is somewhat of a departure from its predecessors, and particularly beloved among fans for its surprise ending. Prisoner of Azkaban also marks the introduction of Sirius Black (Gary Oldman), who has escaped from the title prison after 12 years of incarceration. Believed to have been the right-hand-man of the dark wizard Voldemort, whom Harry (Daniel Radcliffe) mysteriously rendered powerless during his infancy, some of those closest to Harry suspect Black has returned to exact revenge on the boy who defeated his master. Upon his return to school, however, Harry is relatively unconcerned with Black. Run by Albus Dumbledore (Michael Gambon) -- who is widely regarded as the most powerful wizard of the age -- Hogwarts is renowned for its safety. Harry's nonchalance eventually turns to blind rage after accidentally learning the first of Black's many secrets during a field trip to a neighboring village. Of course, a loose serial killer is only one of the problems plaguing the bespectacled wizard's third year back at school -- the soul-sucking guards of Azkaban prison have been employed at Hogwarts to protect the students, but their mere presence sends Harry into crippling fainting spells. With the help of his friends Ron (Rupert Grint) and Hermione (Emma Watson), and Defense Against the Dark Arts professor Remus Lupin (David Thewlis), Harry struggles to thwart the Dementors, find Sirius Black, and uncover the mysteries of the night that left him orphaned. ~ Tracie Cooper, Rovi",Alfonso Cuarn,Director Not Available,Director Not Available,SciFi,PG ,6/04/2004,142 minutes,Warner Bros. Pictures,Harry Potter and the Prisoner of Azkaban,Steve Kloves,Writer Not Available,Writer Not Available,Writer Not Available,2004
Naomi Watts,Eric Thal,Michael Ironside,Edward Herrmann,Dan Hedaya,James Marshall,"At the Millennium Building in NYC, the elevators have a problem... they just can't stop killing people! Pregnant women, skater dudes -- they're all on the menu for these possessed motorized beasts. As elevator repairman Mark Newman (James Marshal) delves deeper into the mystery, everyone from his boss to the building manager stand in his way. His only help comes from Jennifer Naomi Watts, a nosy reporter that smells a cover-up when she sees it. As the ""accidents"" pile up, the President and FBI get involved as the heroic couple come face to face with technology gone horribly, horribly wrong. Down is a direct remake (shot for shot at times) of director Dick Maas' early 80's cult flick The Lift.",Dick Maas,Director Not Available,Director Not Available,SciFi,R,9/06/2001,109 minutes,First Floor Features,Down (The Shaft),Dick Maas,Writer Not Available,Writer Not Available,Writer Not Available,2001
David Keith,Vanessa Angel,John Rhys-Davies,Jenna Gering,Josh Holloway,Lahmard J. Tate,"The subject of the successful speeding up of growth after cloning -- in this case, a full-grown sabretooth tiger -- escapes in a forest and develops a taste for frantic hikers. The insensitive scientists who created the creature, Anthony Bricklin (John Rhys-Davies) and Catherine Viciy (Vanessa Angel), call in chiseled-chin veteran big game hunter Bob Thatcher (David Keith) to sedate the feline before it can get its chompers into fresh victims.",James D.R. Hickox,Director Not Available,Director Not Available,SciFi,R,11/16/2002,90 minutes,LionsGate Entertainment,Sabretooth,Writer Not Available,Writer Not Available,Writer Not Available,Writer Not Available,2002
